,message,intent
292,"What's the formula for calculating velocity? Oh, I see, you're not a physics expert.",fallback
293,I'd appreciate your help in setting up an appointment with one of your doctors.,book_session
294,Tell me what types of medical services and facilities are available at your hospital.,medical_services
295,How can I offer feedback about my recent visit to your hospital?,feedback
296,Could you cancel the appointment I had fixed at your hospital?,session_cancelation
297,I'd be grateful if you could provide me with the hospitals' location and the contact number.,contact_location
298,"I've been experiencing severe anxiety and panic attacks, even in normal situations.",symptoms
299,I'd appreciate the opportunity to give feedback about my recent hospital experience.,feedback
300,Please give me an overview of the healthcare services and facilities at your hospital.,medical_services
301,"No, I don't need any more details.",service_completion
302,Please share the hospitals' location and the contact number with me.,contact_location
303,Tell me about your family or your creators; I'm curious about the minds behind this AI.,fallback
304,"Please, I need to reserve a session with one of your doctors.",book_session
305,I want to change the date of the appointment I made at your hospital.,session_reschedule
306,Is it possible to schedule a doctor's appointment at your hospital?,book_session
307,"Can you teach me how to fly? I'm just kidding, of course.",fallback
308,Tell me about the various medical services and facilities at your hospital.,medical_services
309,Could you guide me on where to give feedback about the hospital's medical tests and diagnostics?,feedback
310,Can you reschedule the appointment I made for [date/time] at your hospital?,session_reschedule
311,I'd like to discuss the option of having a patient admitted to your hospital.,addmission_enqiry
312,What's the recipe for a magic potion? Maybe you can create some digital magic.,fallback
313,"What's the weather like today? Oh, wait, I think I got the wrong chatbot for that.",fallback
314,"No, I don't have any additional questions.",service_completion
315,I'm in need of the hospitals' location and the contact number. Could you assist?,contact_location
316,I've been feeling unusually fatigued and have had a decreased appetite.,symptoms
317,I've decided to change the date of my appointment at your hospital.,session_reschedule
318,"I have no further requests, thank you.",service_completion
319,Can you please give me the hospitals' location and the contact number?,contact_location
320,What medical services and facilities are accessible at your hospital?,medical_services
321,I want to provide feedback on the responsiveness and attentiveness of the hospital staff.,feedback
322,"I have no further requests, thank you.",service_completion
323,"I've been experiencing persistent back pain, especially after sitting for long periods.",symptoms
324,What's the process for making a payment for my appointment?,payment
325,"Hi, buddy!",greeting
326,"Greetings, chatbot!",greeting
327,"Would you mind sharing the hospitals' location and the contact number, please?",contact_location
328,I'd like to reschedule my appointment at your hospital and arrange for another date.,session_reschedule
329,I'm inquiring about the possibility of admitting a patient to your hospital.,addmission_enqiry
330,Tell me how to finalize the payment for this appointment.,payment
331,"No, I have no further inquiries.",service_completion
332,"Hi, virtual assistant!",greeting
333,"I want to make an appointment with one of your doctors, can you provide the necessary details?",book_session
334,What types of healthcare services and facilities does your hospital have?,medical_services
335,I have a patient in need of hospitalization and would like to request their admission.,addmission_enqiry
336,"I need to set up a meeting with one of your doctors, your help is valued.",book_session
337,How can I proceed with the payment for my appointment?,payment
338,Do you like pizza? I wonder if AI chatbots have food preferences.,fallback
339,What medical services and facilities are accessible to patients at your hospital?,medical_services
340,"Hey, AI buddy!",greeting
341,I feel a pounding sensation in my chest and it's accompanied by shortness of breath.,symptoms
342,"May I request the hospitals' location and the contact number from you, please?",contact_location
343,"I've noticed changes in my sleep patterns, appetite, and energy levels, and I'm losing interest in activities I used to enjoy.",symptoms
344,Can you please reschedule the appointment I had arranged at your hospital?,session_reschedule
345,Can you speak English? I hope you're not using some alien language I can't comprehend.,fallback
346,I'd appreciate the chance to give feedback on the hospital's discharge process.,feedback
347,"Hey, chatbot, nice to see you!",greeting
348,"No, that's all I needed help with.",service_completion
349,Could you tell me how to submit feedback about my recent hospital visit?,feedback
350,I'd appreciate it if you could brief me about the healthcare services and facilities you offer.,medical_services
351,I want to provide feedback on the facilities and services at your hospital.,feedback
352,I'm hoping you can help me book an appointment with one of your doctors.,book_session
353,"No, I'm satisfied with the support received.",service_completion
354,What payment options are there for this scheduled appointment?,payment
355,I am formally requesting admission to your hospital on behalf of a patient.,addmission_enqiry
356,Please reschedule the appointment I had set for [date/time] at your hospital.,session_reschedule
357,I need to reschedule my appointment at your hospital and find a new available slot.,session_reschedule
358,Please consider this as my official request for patient admission to your hospital.,addmission_enqiry
359,"I'm feeling sad, and I thought talking to a chatbot might cheer me up, but it seems it won't work.",fallback
360,Please consider this as my official request for hospital admission on behalf of a patient.,addmission_enqiry
361,Please cancel my appointment at your hospital. I won't be able to make it.,session_cancelation
362,Can you cancel the appointment I had reserved at your hospital?,session_cancelation
363,I'm unable to keep my appointment at your hospital. Can you help me reschedule it?,session_reschedule
364,"I've been experiencing blurry vision, especially when trying to read or focus on objects.",symptoms
365,I'm looking to arrange for a patient's admission to your hospital.,addmission_enqiry
366,What's the airspeed velocity of an unladen swallow? An old-school Monty Python reference!,fallback
367,I'd like to discuss the possibility of admitting a patient to your hospital.,addmission_enqiry
368,Good afternoon!,greeting
369,"I have no further matters, thank you.",service_completion
370,"Hey, smart bot, how can you assist me?",greeting
371,"What's up, bot?",greeting
372,I wanted to share my feedback about my recent hospital visit.,feedback
373,I'm looking for the hospitals' location and contact number. Could you help me out?,contact_location
374,Please let me know the steps required to request admission for a patient at your hospital.,addmission_enqiry
375,"I'm satisfied with the resolution, thanks.",service_completion
376,"I need help with my personal problems, but I guess you're just a chatbot, not a therapist.",fallback
377,"What's the meaning of life? I know it's a deep question, but I thought I'd give it a shot.",fallback
378,Can you help me cancel the appointment I made at your hospital?,session_cancelation
379,I want to cancel the appointment I made at your hospital and book a new one.,session_cancelation
380,I need to cancel my appointment at your hospital due to an emergency.,session_cancelation
381,I'd like to know the various medical services and facilities at your hospital.,medical_services
382,I need to reschedule my appointment at your hospital as my plans have changed.,session_reschedule
383,Could you assist me in canceling my appointment at your hospital?,session_cancelation
384,I require the hospitals' location and the contact number. Could you share them?,contact_location
385,"Hi there, amazing bot!",greeting
386,"Hey, virtual buddy!",greeting
387,I'd appreciate the opportunity to give feedback about the hospital's pharmacy services.,feedback
388,"Hi, there, clever bot!",greeting
389,Please cancel the appointment I made at your hospital. I won't be able to attend.,session_cancelation
390,Please cancel my appointment at your hospital as my plans have changed.,session_cancelation
391,What's the best diet for losing weight? A chatbot nutritionist might be helpful!,fallback
392,"I've missed my menstrual periods, and I'm experiencing nausea and fatigue.",symptoms
393,I want to share my feedback about the billing and administrative process at your hospital.,feedback
394,"Well, hello there!",greeting
395,Can you provide information on the payment methods for this appointment?,payment
396,I'm interested in knowing the accepted payment options for this appointment.,payment
397,Can you provide information on the payment process for this appointment?,payment
398,"Hey, how are you?",greeting
399,"I don't require any more details, thanks.",service_completion
400,How can I make the necessary payment for this appointment?,payment
401,Is there a specific way to provide feedback about my recent hospital stay?,feedback
402,I need to reschedule my appointment at your hospital due to personal reasons.,session_reschedule
403,"I'd like to schedule a session with one of your doctors, please help me.",book_session
404,Please reschedule the appointment I made at your hospital. I won't be able to attend.,session_reschedule
405,I need the hospitals' location and the contact number. Could you help me out?,contact_location
406,My newborn baby was born prematurely and requires specialized care due to their early arrival.,symptoms
407,I'm looking for the hospitals' location and the contact number. Can you provide them?,contact_location
408,I'd appreciate it if you could give me the hospitals' location and the contact number.,contact_location
409,How tall is the Eiffel Tower? Just testing your general knowledge.,fallback
410,I'd appreciate the chance to give feedback on my recent experience at your hospital.,feedback
411,Hi!,greeting
412,I need your assistance in setting up an appointment with one of your doctors.,book_session
413,"Hi there, chatbot!",greeting
414,I'm formally requesting hospital admission for a patient who requires medical attention.,addmission_enqiry
415,"I've noticed changes in my urine color, and I'm experiencing pain or discomfort in my lower back.",symptoms
416,What's the meaning of this word? I feel like I'm in a dictionary mode now.,fallback
417,"I want to book a consultation with one of your doctors, please guide me.",book_session
418,I'm unable to keep my appointment at your hospital. Can you help me cancel it?,session_cancelation
419,I'm no longer able to make it to the appointment at your hospital. Can we cancel it?,session_cancelation
420,"Can you help me schedule a session with one of your doctors, please?",book_session
421,"Well, hello, chatbot genius!",greeting
422,"I'm interested in seeing one of your doctors, can you provide me with the next available slot?",book_session
423,Is there a platform or email where I can send my feedback regarding my hospital visit?,feedback
424,Is there a survey or questionnaire for me to provide feedback about my hospital experience?,feedback
425,I'm good with the information provided.,service_completion
426,I'd like to reschedule the appointment I had scheduled with [doctor's name] at your hospital.,session_reschedule
427,Can you help me reschedule the appointment I made at your hospital?,session_reschedule
428,I've been having irregular vaginal bleeding between periods.,symptoms
429,Can you explain the medical services and facilities available at your hospital?,medical_services
430,"That's all for this interaction, thank you.",service_completion
431,"That's all for now, thanks.",service_completion
432,I want to change the date of my previously arranged appointment at your hospital.,session_reschedule
433,"Would you mind sharing the hospital's location and contact number, please?",contact_location
434,I'd like to cancel the appointment I made at your hospital and schedule a new one.,session_cancelation
435,Please reschedule the appointment I booked at your hospital. Something came up.,session_reschedule
436,"I've been experiencing recurrent sneezing, runny nose, and itchy, watery eyes, especially in certain environments.",symptoms
437,I'm satisfied with the help received.,service_completion
438,I need to reschedule my upcoming appointment at your hospital.,session_reschedule
439,Please assist me in reserving a session with one of your doctors.,book_session
440,How can I proceed with the payment for my confirmed appointment?,payment
441,"What's the meaning of the universe? I know, I know, it's a big question.",fallback
442,What payment modes are available for me to pay for this appointment?,payment
443,What healthcare services and facilities do you have for patients' convenience?,medical_services
444,"I'm looking to book a session with one of your doctors, can you tell me how to proceed?",book_session
445,"I'm looking to reserve a slot with one of your doctors, can you provide available dates?",book_session
446,I want to make an appointment with a doctor from your medical team.,book_session
447,I want to change the date of my appointment at your hospital and find a more suitable time.,session_reschedule
448,Is it possible to admit a patient to your hospital upon my request?,addmission_enqiry
449,Would you be able to give me the hospitals' location and the contact number?,contact_location
450,I need to reschedule the appointment I scheduled at your hospital.,session_reschedule
451,I've decided to cancel my appointment at your hospital.,session_cancelation
452,Tell me about the healthcare services and facilities available at your hospital.,medical_services
453,"Hey, helpful virtual friend!",greeting
454,Please cancel the appointment I had set for [date/time] at your hospital.,session_cancelation
455,"Please, I need to make an appointment with one of your doctors as soon as possible.",book_session
456,Tell me about the healthcare services and facilities that I can avail at your hospital.,medical_services
457,"No, that's all I wanted to discuss.",service_completion
458,Could you please assist me in canceling my appointment at your hospital?,session_cancelation
459,How can I offer feedback on the efficiency and organization of your hospital?,feedback
460,"That covers all my requirements, thanks.",service_completion
461,"Hey, virtual friend!",greeting
462,I'm content with the assistance provided.,service_completion
463,I'd like to reschedule my appointment at your hospital and find a new suitable date.,session_reschedule
464,What are the healthcare services and facilities that your hospital extends?,medical_services
465,What options do I have for paying for this appointment?,payment
466,Could you please disclose the hospitals' location and the contact number?,contact_location
467,Hey!,greeting
468,I've recently suffered a sports injury and my ankle is swollen and painful.,symptoms
469,Can you guide me on how to make an appointment with one of your doctors?,book_session
470,Is there a specific procedure for requesting hospital admission for a patient?,addmission_enqiry
471,"Yo, bot!",greeting
472,My newborn has jaundice and requires monitoring and treatment to manage their bilirubin levels.,symptoms
473,I've been experiencing sudden hair loss and the skin on my scalp is becoming scaly.,symptoms
474,"I've been experiencing persistent joint pain and stiffness, particularly in my knees and hips.",symptoms
475,I have a persistent bad taste in my mouth and bad breath despite regular oral hygiene.,symptoms
476,Can I share my thoughts and feedback on my recent hospital visit with you?,feedback
477,What's the process for completing the payment for this appointment?,payment
478,Can you please cancel the appointment I had arranged at your hospital?,session_cancelation
479,Could you kindly let me know the hospitals' location and the contact number?,contact_location
480,"No, that's everything I was looking for.",service_completion
481,Please cancel the appointment I made at your hospital.,session_cancelation
482,I'm interested in having a patient admitted to your hospital and would like your assistance.,addmission_enqiry
483,I need to cancel the appointment I had confirmed at your hospital.,session_cancelation
484,"I often feel bloated and have frequent indigestion, even with smaller meals.",symptoms
485,"That's everything I wanted to confirm, thanks.",service_completion
486,Tell me the details for making the payment for this appointment.,payment
487,"That's all I wanted to verify, thank you.",service_completion
488,"Do you have any pets? Or do chatbots have digital pets, if that's even a thing?",fallback
489,Can you share information on the medical services and facilities you provide?,medical_services
490,"I've been having difficulty swallowing, and I feel a lump in my throat.",symptoms
491,I'd like to cancel my appointment at your hospital and make a new reservation.,session_cancelation
492,I'd like to give feedback about the communication with the medical staff during my visit.,feedback
493,I'd like to give feedback about the hospital's pain management and comfort measures.,feedback
494,How are you doing today?,greeting
495,I'm looking for the hospitals' location and the contact number. Could you assist?,contact_location
496,"No, that's sufficient for now.",service_completion
497,I need guidance on how to pay for my scheduled appointment.,payment
498,Could you assist me in reserving a slot with one of your doctors?,book_session
499,"Please, I need to make an appointment to see one of your doctors.",book_session
500,Could you guide me on the process for requesting hospital admission for a patient?,addmission_enqiry
501,I need to understand how to pay for my confirmed appointment.,payment
502,I want to change the date of the appointment I had arranged at your hospital.,session_reschedule
503,"Howdy, chatbot!",greeting
504,"Hello, intelligent assistant!",greeting
505,Please provide details about the medical services and facilities extended by your hospital.,medical_services
506,Could you provide information on how to request hospital admission for a patient?,addmission_enqiry
507,Can you please provide me with the hospitals' location and the contact number?,contact_location
508,"Greetings, virtual chat assistant!",greeting
509,"No, that's all I wanted to clarify.",service_completion
510,Who won the World Series in 1953? Let's see if you have historical sports knowledge.,fallback
511,"Can you predict my future? You know, like a digital fortune teller.",fallback
512,Can you please furnish me with the hospitals' location and the contact number?,contact_location
513,I've been experiencing sharp chest pain that radiates to my left arm.,symptoms
514,Please enlighten me on the medical services and facilities available at your hospital.,medical_services
515,What are the medical services and facilities you offer to patients?,medical_services
516,What are the healthcare services and facilities that your hospital offers to patients?,medical_services
517,"I'm not sure what to ask, I'm just trying to see how you respond to different types of questions.",fallback
518,Can you provide me with the payment instructions for this appointment?,payment
519,Could you please help me arrange a consultation with one of your doctors?,book_session
520,I'd like to reschedule my appointment at your hospital and find a new convenient date.,session_reschedule
521,I need to set up a meeting with one of your doctors. Can you assist me?,book_session
522,"I've had a persistent cough and congestion, and my energy levels are lower than usual.",symptoms
523,Tell me a joke or something amusing; I could use a good laugh right now.,fallback
524,What payment methods can I use to pay for this appointment?,payment
525,Please consider this as my formal request for patient admission to your hospital.,addmission_enqiry
526,Please reschedule the appointment I made at your hospital.,session_reschedule
527,"I've noticed weakness or numbness in one side of my body, along with difficulty speaking.",symptoms
528,I'm having difficulty controlling my urine flow and often experience leakage.,symptoms
529,Can you guide me on how to make an appointment with one of your doctors?,book_session
530,"I need the hospitals' location and contact number. Can you provide them, please?",contact_location
531,I'm no longer able to make it to the appointment at your hospital. Can we reschedule it?,session_reschedule
532,"Hi there, helpful bot!",greeting
533,I'm hoping you can help me arrange a doctor's appointment at your hospital.,book_session
534,Could you please share the hospital's location and contact number with me?,contact_location
535,I've noticed sudden flashes of light and floating spots in my field of vision.,symptoms
536,Tell me about the payment procedures for this appointment.,payment
537,I'd like to share my feedback about the medical staff during my recent hospital visit.,feedback
538,"What's the meaning of this dream I had last night? I know, it's a bit personal.",fallback
539,"I'd like to schedule a consultation with one of your doctors, can you help?",book_session
540,Can you recommend a good movie to watch? I'm in the mood for something entertaining.,fallback
541,I want to change the date of my appointment at your hospital and find a new one.,session_reschedule
542,Can you please give me the hospitals' location and the contact number?,contact_location
543,Please reschedule my appointment at your hospital. I won't be able to make it on [date/time].,session_reschedule
544,I want to cancel the appointment I made for [date/time] at your hospital.,session_cancelation
545,Is it feasible to arrange for a patient's admission to your hospital at this time?,addmission_enqiry
546,Please reschedule my appointment at your hospital as my plans have changed.,session_reschedule
547,"What's the best way to win the lottery? I know it's a long shot, but any tips?",fallback
548,I want to cancel my previously arranged appointment at your hospital.,session_cancelation
549,Hello there!,greeting
550,Please let me know the necessary steps to request hospital admission for a patient.,addmission_enqiry
551,Could you guide me on how to give feedback about my recent hospital visit?,feedback
552,How's my favorite AI today?,greeting
553,Tell me how to make a secure payment for this appointment.,payment
554,Please cancel the appointment I booked at your hospital. Something came up.,session_cancelation
555,I'm formally requesting hospital admission for a patient under my responsibility.,addmission_enqiry
556,"I don't require any more help, thanks.",service_completion
557,Could you help me schedule an appointment with one of your doctors?,book_session
558,I've had sudden episodes of dizziness and fainting.,symptoms
559,I've developed hives and skin rashes after consuming certain foods or coming into contact with specific substances.,symptoms
560,"No, I have no more issues to address.",service_completion
561,"Hi there, digital companion!",greeting
562,How can I offer feedback on the hospital's communication and information sharing with patients?,feedback
563,Please cancel the appointment I had set at your hospital. I'll need to schedule another one later.,session_cancelation
564,I need to reschedule the appointment I had confirmed at your hospital.,session_reschedule
565,"Where is Atlantis located? I know it's a myth, but let's play along.",fallback
566,Can you please offer the hospitals' location and the contact number?,contact_location
567,What are the healthcare services and facilities that your hospital extends to patients?,medical_services
568,Please give me an overview of the healthcare services and facilities at your hospital.,medical_services
569,I want to change the date of my appointment with [doctor's name] at your hospital.,session_reschedule
570,Please reschedule my appointment at your hospital. I won't be able to make it.,session_reschedule
571,I'm satisfied with the assistance.,service_completion
572,I'd like to reschedule my appointment at your hospital and book a new one.,session_reschedule
573,"No, that's all for this interaction.",service_completion
574,Can you list the healthcare services and facilities provided at your hospital?,medical_services
575,I'd like to offer feedback about the overall patient experience during my hospital visit.,feedback
576,"If possible, please share the hospitals' location and the contact number.",contact_location
577,What's the cure for a broken heart? A chatbot's response might not be enough.,fallback
578,I am seeking admission for a patient to your esteemed hospital.,addmission_enqiry
579,I'm pregnant and experiencing heavy bleeding and abdominal pain.,symptoms
580,Who is the president of [random country]? Just thought I'd test your knowledge.,fallback
581,"That's all I needed from you, thank you.",service_completion
582,I need to find a new date for my appointment at your hospital. Can we reschedule it?,session_reschedule
583,"I'm interested in booking a session with one of your doctors, can you assist?",book_session
584,I'm interested in knowing about the healthcare services and facilities offered by your hospital.,medical_services
585,"If you could, please provide me with the hospitals' location and the contact number.",contact_location
586,What are the available payment methods for this appointment?,payment
