,message,intent
587,Can you assist me in scheduling a doctor's appointment at your facility?,book_session
588,Could you please provide information on how to request hospital admission for a patient?,addmission_enqiry
589,"I'm lost, can you help me find my way home? I hope you have a digital GPS.",fallback
590,I require the hospitals' location and the contact number. Could you share them?,contact_location
591,"Hello, smart AI!",greeting
592,Please enlighten me on the healthcare services and facilities at your hospital.,medical_services
593,Can you assist me with the process of providing feedback about the hospital's dietary services?,feedback
594,Can you assist me with the process of providing feedback about my recent hospital visit?,feedback
595,I'd like to share my feedback about the medical equipment and facilities at your hospital.,feedback
596,I'm interested in initiating the process for patient admission to your hospital.,addmission_enqiry
597,"I want to book an appointment with one of your doctors, can you guide me through the process?",book_session
598,Would you mind giving me the hospitals' location and the contact number?,contact_location
599,"If possible, please share the hospitals' location and the contact number.",contact_location
600,I'd like to cancel my appointment at your hospital and reschedule it for a later date.,session_cancelation
601,Could you guide me on how to proceed with the request for hospital admission for a patient?,addmission_enqiry
602,"Would you mind sharing the hospitals' location and the contact number, please?",contact_location
603,"How's it going, chatbot?",greeting
604,"I've been having difficulty breathing and wheezing, especially when exposed to pollen or pet dander.",symptoms
605,Please reschedule the appointment I had confirmed at your hospital. I'll need to make a fresh appointment.,session_reschedule
606,I'm looking to request admission for a patient who needs medical care at your hospital.,addmission_enqiry
607,What are the payment arrangements for this scheduled appointment?,payment
608,Is it possible to schedule a doctor's appointment at your hospital?,book_session
609,How do I go about paying for this appointment I just booked?,payment
610,"I don't need any additional information, thanks.",service_completion
611,I'm looking for the hospitals' location and the contact number. Can you provide them?,contact_location
612,Would you be able to give me the hospitals' location and the contact number?,contact_location
613,Can you please furnish me with the hospitals' location and the contact number?,contact_location
614,"Can you do my homework? Just kidding, I know you're not a cheating machine.",fallback
